{
  "version": "1",
  "kind": "ControlPlaneEvidence",
  "hostname": "router.example.test",
  "issuedAt": "2026-01-15T11:55:00.000Z",
  "certFingerprint": "sha256/d4d-LKXzAIf1DOWon1SzGssmcjKrG1k2hQ-NiU5z_z8",
  "jws": "eyJhbGciOiJSUzI1NiJ9.eyJ2ZXJzaW9uIjoiMSIsImhvc3RuYW1lIjoicm91dGVyLmV4YW1wbGUudGVzdCIsImlzc3VlZEF0IjoiMjAyNi0wMS0xNVQxMTo1NTowMC4wMDBaIiwiY2VydEZpbmdlcnByaW50Ijoic2hhMjU2L2Q0ZC1MS1h6QUlmMURPV29uMVN6R3NzbWNqS3JHMWsyaFEtTmlVNXpfejgiLCJraW5kIjoiRGVwbG95bWVudEV2aWRlbmNlIiwiZXZpZGVuY2VEaWdlc3QiOiJzaGEyNTYvd2VNZHlDbjNWTlVvc1YwTXhmNlAxRDhpV0dYVnlUWl9kLTV2RVc0UTlxcyIsImV2aWRlbmNlIjp7InZlcnNpb24iOjIsInJlc291cmNlcyI6W3sia2luZCI6IkRlcGxveW1lbnQiLCJuYW1lIjoicm91dGVyLWFwaSIsIm5hbWVzcGFjZSI6ImNvbmZpZGVudGlhbC1yb3V0ZXIiLCJjb250YWluZXJzIjpbeyJuYW1lIjoicm91dGVyLWFwaSIsImltYWdlIjoiZ2hjci5pby9zdXBlci1wcm90b2NvbC9yb3V0ZXItYXBpQHNoYTI1NjoxMTExMTExMTExMTExMTExMTExMTExMTExMTExMTExMTExMTExMTExMTExMTExMTExMTExMTExMTExMTExMTExIn1dfSx7ImtpbmQiOiJEZXBsb3ltZW50IiwibmFtZSI6ImxpdGVsbG0iLCJuYW1lc3BhY2UiOiJjb25maWRlbnRpYWwtcm91dGVyIiwiY29udGFpbmVycyI6W3sibmFtZSI6ImxpdGVsbG0iLCJpbWFnZSI6ImdoY3IuaW8vYmVycmlhaS9saXRlbGxtQHNoYTI1NjoyMjIyMjIyMjIyMjIyMjIyMjIyMjIyMjIyMjIyMjIyMjIyMjIyMjIyMjIyMjIyMjIyMjIyMjIyMjIyMjIyMjIyIn1dfV19fQ.nXBZrTR_5oU4yg-7jnRBuQG2wxIaYt09cRp9YNJIjENrIx_svZSqiJrXXmSOqTx9jBj7Dd5PILe-t-01RhnTD-OJ5p04yeX9K10s3f439mmBBF2tCz5m_OutCtqQUh9Y1fWU5SPofaWk6bkbyLVjwkeYU4_HKucE-eugG78ldYsqUu-YJFOkREOeTi8xV_69LEvn1IKReFBc3YivRnyl1DAMv8kBqmK3c2mjvsoHOl1W2ydeKq2HCanI0kpVVwj8iY6H6EGEssM41A_d1FKCLUd2HFp5b3M_hAqIKzehT6iwuKHQryYVTdmERaDDThdg3pAxp2uSop9ZWf-eQYs9HQ",
  "certChain": [
    "-----BEGIN CERTIFICATE-----\nMIIDKTCCAhGgAwIBAgIBAzANBgkqhkiG9w0BAQsFADA0MTIwMAYDVQQDEyljb25m\naWRlbnRpYWwtcm91dGVyLXRlc3QtaW50ZXJtZWRpYXRlLXJzYTAeFw0yNjAxMDEw\nMDAwMDBaFw0yNzAxMDEwMDAwMDBaMB4xHDAaBgNVBAMTE3JvdXRlci5leGFtcGxl\nLnRlc3QwggEiMA0GCSqGSIb3DQEBAQUAA4IBDwAwggEKAoIBAQCtcMqJAU4jhDQr\n4tWmhF3F/bDxOANS0OSzIY++hxtjjlbbMQ/4e/Ws6N1vpKy1pxCIdqHH0FiuMApM\n5cquuhCWDq8lypeJwEBkOQvZ5nBGXh2UqM9X8ksJ7d59Co8f88pXqNLOFgdfpdzx\neRgqF1ZcvsFs/KdEsVzYdeDZXgq1ZG8W9bTFUqKFMenxsJD2PhDPox6r70XWMI/g\n5HRP5rc331yJOyEFFu683wCmdfZar6vILFmpEiKvJhXxhNMoKjCb7onp7H2nZae1\n6s08FeKT2PUROHqgGtWkfUzsYfvZJ2YyspX5hCOjiX3aR9tCFD2ozpKA9W9dBvUr\nk4arh/5zAgMBAAGjXDBaMAkGA1UdEwQCMAAwDgYDVR0PAQH/BAQDAgWgMB0GA1Ud\nJQQWMBQGCCsGAQUFBwMBBggrBgEFBQcDAjAeBgNVHREEFzAVghNyb3V0ZXIuZXhh\nbXBsZS50ZXN0MA0GCSqGSIb3DQEBCwUAA4IBAQBh9M4nDHPDF8MpxBVyqM4QoT7V\nMJDHJCjOr99hnEUaX23JwvI7sgVORmVO3LrtNsHcrL2eFCicyDi2Tl42lg4Ec/Xa\nUDnafigqaU/BzOJF/bmydmhQlgc6HyLONiTMrgvxzcixQN/zabWqv9ppuGmqQ59Y\nUomOw8VWsdLw1tTyt5hpyeZVqR82UDPdNs2lLheB7Icf5bF/mF9LOseIGtfeVhDy\nCcBqpGZJ8YiPS+SKIHEZtT5644ht4iiLFJrUacZVh4PTiA3GjIAG9TutpjiMhe3f\nnGTwt7M8Z1t/wy2/P/2VWa0G67ldJMSP9Rk7yzjgqeifQ2a+uYWnnxzXZV3K\n-----END CERTIFICATE-----",
    "-----BEGIN CERTIFICATE-----\nMIIDATCCAemgAwIBAgIBAjANBgkqhkiG9w0BAQsFADAsMSowKAYDVQQDEyFjb25m\naWRlbnRpYWwtcm91dGVyLXRlc3Qtcm9vdC1yc2EwHhcNMjYwMTAxMDAwMDAwWhcN\nMjcwMTAxMDAwMDAwWjA0MTIwMAYDVQQDEyljb25maWRlbnRpYWwtcm91dGVyLXRl\nc3QtaW50ZXJtZWRpYXRlLXJzYTCCASIwDQYJKoZIhvcNAQEBBQADggEPADCCAQoC\nggEBAKklJ0BrVVPEhR/gxE5NdPjV8PVORlUR+J3U99jvM44JPwpXGgROpFXsxVPa\n8/cW+63dEtkdrrrE1T4Tw5mxvL6vfGLAp/kMkpExgdVk5EfutKtEXoaEC7VHAzBT\nP4TmhYCE3foS9qrerN7EpsBzDj+1lLnBw45lreuSU4hVFZH0Fh56iSJlM98erh3x\nhb9jK0PSIt3HUrx9UVoqYOIg/Jao/yOvuNyE4f7bciiBX/DUg5PfecutBGi+g7yn\nJDG1tf+8lcXNCHVsZ3NMw1/JErc2a0iNi3oiOeWByXmeYziO69aOUXB9rWqRrn/4\nd1w+2y+ur24aLZ/sCVkJooM50cUCAwEAAaMmMCQwEgYDVR0TAQH/BAgwBgEB/wIB\nADAOBgNVHQ8BAf8EBAMCAQYwDQYJKoZIhvcNAQELBQADggEBAJI5RWYdczY3KcHO\njFj5XExvXlv5C1d04ZnrR3DQ0ffB3mNLF0nmMgi6eYsgWj0GheQo10HrKwj/TAN5\nj1F/2OviwrHNXjMkOmGEUDs3ENSqWdoFLB2xg8gxUrtPF8p3ckiXQxvrS1ZdcIkP\neFILYUvNeZTpsmYeLXQtsKhetAlZAVhcW7lFiMculzxWSU+j+upcHUbNYTzMILIk\nzbONvo5kIbIm15532XSXsa/npc4ieroGkWgnonSbo71UcI7AJB+BnhVKQKpAOiT6\nqu50kgFTKvDNgK/DI9i1ChdlCEs6eKFXuC8AFSdHsudV8XjMBR5dbEi/TOzUteO6\n+Xsp6y0=\n-----END CERTIFICATE-----",
    "-----BEGIN CERTIFICATE-----\nMIIC9jCCAd6gAwIBAgIBATANBgkqhkiG9w0BAQsFADAsMSowKAYDVQQDEyFjb25m\naWRlbnRpYWwtcm91dGVyLXRlc3Qtcm9vdC1yc2EwHhcNMjYwMTAxMDAwMDAwWhcN\nMjcwMTAxMDAwMDAwWjAsMSowKAYDVQQDEyFjb25maWRlbnRpYWwtcm91dGVyLXRl\nc3Qtcm9vdC1yc2EwggEiMA0GCSqGSIb3DQEBAQUAA4IBDwAwggEKAoIBAQC6hiHK\nRFQHYsbS5JLuPoNp2zPVsvRuhtv6vtUR6PXFBnm5WPOJISWvJ2d3MYJjFaFekETR\nGz4jymCGwoG14WnlR4o2SXpnteqGbKhW62AqDafdZ+HUnus2o8pIiaiqZ4NkDTKC\n660IUUA9oCkFx/5LKjHPHao1hyIosHZuAuyKl3gx2QcyoCmjiXYQ6wklOZCVm7QK\nbb2z0buXZygrDvz5sz3ZmAmUlcIl70NIR6h0pX796y/5GQSepLRnL0StUA2D6Qyz\nl8nkcMvA8wNc2v/ztJ9FTAP/nWK7JK6MbHgrCZYkIf0YOW+OkkbJF0uUMDHibjI1\nqJg1MQWNl9OZs0NbAgMBAAGjIzAhMA8GA1UdEwEB/wQFMAMBAf8wDgYDVR0PAQH/\nBAQDAgEGMA0GCSqGSIb3DQEBCwUAA4IBAQCSq6wVI49gU3isMkfvwSLp4n/BAjeE\n95u17dkJ3wsqo5gUG4uC8zTYQP0GsgouK71ncD7ur7t1l5/olzlz/m1J+OZvdQoa\npkPCCHBo8pGoF79eSs3+YEpyiwRC6jfNF5r7u9V1EVSGoZUaij7OBzA3UHpzl7SV\nowErpNKOzM1noE3CWlaeeSfIF/84ZgsZNLQdk5ZiykR+75NHu4EgKc6qMjitrZah\nEV1WmTx18K8tGEndo7ypmprJjjf1kGc3V3WGAPluelyuCMb5bW6yMxzZk2j+az1W\npj22H2CKir9AnKIxA4KYoyPygr3HtmJFiVqR+BH1JhPgfyJxK3HouNU4\n-----END CERTIFICATE-----"
  ]
}
