{
  "version": "1",
  "kind": "DeploymentEvidence",
  "hostname": "router.example.test",
  "issuedAt": "2026-01-15T11:55:00.000Z",
  "certFingerprint": "sha256/dFGdIS_aI2ZCYj01GGJq-xMEBX_1kn9DrilHdF6hwn8",
  "jws": "eyJhbGciOiJSUzI1NiJ9.eyJ2ZXJzaW9uIjoiMSIsImhvc3RuYW1lIjoicm91dGVyLmV4YW1wbGUudGVzdCIsImlzc3VlZEF0IjoiMjAyNi0wMS0xNVQxMTo1NTowMC4wMDBaIiwiY2VydEZpbmdlcnByaW50Ijoic2hhMjU2L2RGR2RJU19hSTJaQ1lqMDFHR0pxLXhNRUJYXzFrbjlEcmlsSGRGNmh3bjgiLCJraW5kIjoiRGVwbG95bWVudEV2aWRlbmNlIiwiZXZpZGVuY2VEaWdlc3QiOiJzaGEyNTYvd2VNZHlDbjNWTlVvc1YwTXhmNlAxRDhpV0dYVnlUWl9kLTV2RVc0UTlxcyIsImV2aWRlbmNlIjp7InZlcnNpb24iOjIsInJlc291cmNlcyI6W3sia2luZCI6IkRlcGxveW1lbnQiLCJuYW1lIjoicm91dGVyLWFwaSIsIm5hbWVzcGFjZSI6ImNvbmZpZGVudGlhbC1yb3V0ZXIiLCJjb250YWluZXJzIjpbeyJuYW1lIjoicm91dGVyLWFwaSIsImltYWdlIjoiZ2hjci5pby9zdXBlci1wcm90b2NvbC9yb3V0ZXItYXBpQHNoYTI1NjoxMTExMTExMTExMTExMTExMTExMTExMTExMTExMTExMTExMTExMTExMTExMTExMTExMTExMTExMTExMTExMTExIn1dfSx7ImtpbmQiOiJEZXBsb3ltZW50IiwibmFtZSI6ImxpdGVsbG0iLCJuYW1lc3BhY2UiOiJjb25maWRlbnRpYWwtcm91dGVyIiwiY29udGFpbmVycyI6W3sibmFtZSI6ImxpdGVsbG0iLCJpbWFnZSI6ImdoY3IuaW8vYmVycmlhaS9saXRlbGxtQHNoYTI1NjoyMjIyMjIyMjIyMjIyMjIyMjIyMjIyMjIyMjIyMjIyMjIyMjIyMjIyMjIyMjIyMjIyMjIyMjIyMjIyMjIyMjIyIn1dfV19fQ.HomwWrwqlUp8loSSMB4q-RAAsPpxFRvyWygU6wMZHv6TTceyl35xH-ZqeRBdCxEB3GTSKiRyo-u0W5awxuV8jzowSIYyTjK3Vh-cIhcnE9-oZS3MNtsQqViirLkwVEBjS-8nWLmXxz8fbJYYSHC-5E8N3t7D0Aupdy274yw3m5THXoGL4O08Xy18yrEoAESAQdgNHUUyXCAVrW4gQ7SePEpWT7YXH2QYRdEEl7J8IufMGjfWzuDxbQUPqYfvzJ7zFHf89C9qcu2bTCzWtJFQx3qodxarG5hlMeZGNVBtnFIHJ7J7QEP0npLWfL73UtmYNc9YDHSfcjRGv16Jq9BcIw",
  "certChain": [
    "-----BEGIN CERTIFICATE-----\nMIIDHDCCAgSgAwIBAgIBEzANBgkqhkiG9w0BAQsFADAnMSUwIwYDVQQDExxvdGhl\nci1jbG91ZC1pbnRlcm1lZGlhdGUtcnNhMB4XDTI2MDEwMTAwMDAwMFoXDTI3MDEw\nMTAwMDAwMFowHjEcMBoGA1UEAxMTcm91dGVyLmV4YW1wbGUudGVzdDCCASIwDQYJ\nKoZIhvcNAQEBBQADggEPADCCAQoCggEBALfvkIAQcPIM/pGWMLqLe2NbwbxV//vM\nDch8DgQrMIimNbdRomXKYhT9N6IrwTUgLl5+V2DKN+ZTNZKEX5MCoONYCxnEE8wH\ngbAzy5fNTkSnUaHNmJrJFV8F0iVRcALqARb+MEz/MhvLbKgHkGYr0pmuqdKWgTQR\nSOoS2yhM04tyM29SIwwJkTQTgnWRwU6ZOK9dkYnP+qzx7iLL/Kb/rpL5HeDnJDm7\nh93Hv/YSNW6vOjAYfxfBa/Y7R4TsyzfG7StBBD4N2/MdQjrjs9jDa1AcLXwIepIS\ntiafkWHA5IQsy/4ClnTxJMtKLgPMm6KK3PjZnpTUmgJTOwvsLBlQfssCAwEAAaNc\nMFowCQYDVR0TBAIwADAOBgNVHQ8BAf8EBAMCBaAwHQYDVR0lBBYwFAYIKwYBBQUH\nAwEGCCsGAQUFBwMCMB4GA1UdEQQXMBWCE3JvdXRlci5leGFtcGxlLnRlc3QwDQYJ\nKoZIhvcNAQELBQADggEBAGZn/nfTtwhwxFA4C0i971MA+afkX3wPW4cVAg9pom9K\niYmZO8X0JAFpLtnfClJ3JK/fHt/2LI7qpcswblDE1k60aSaDI18vdQeciNT9r/Je\n84eVRbQNqf8AEXiGmRwEqGXTXxARlxejWefEcyGbuYWkf62uqc8T+huSw+W1PChV\nXdkweHikv6KHapyaPU4OsXOHQyM8XCqxkwtoYLOBXqFmukQH7cegsdp4uTYlHwgn\nh6lsuvQlOD54uHwfVTVltbODohWZltYCpaHrlypQMh2jPigkVsCCD9qiyfqJXgO1\nqTh7rYKNFA2CgMconN5/cygP6EpFBS1wPKJOIWEQLHs=\n-----END CERTIFICATE-----",
    "-----BEGIN CERTIFICATE-----\nMIIC5zCCAc+gAwIBAgIBEjANBgkqhkiG9w0BAQsFADAfMR0wGwYDVQQDExRvdGhl\nci1jbG91ZC1yb290LXJzYTAeFw0yNjAxMDEwMDAwMDBaFw0yNzAxMDEwMDAwMDBa\nMCcxJTAjBgNVBAMTHG90aGVyLWNsb3VkLWludGVybWVkaWF0ZS1yc2EwggEiMA0G\nCSqGSIb3DQEBAQUAA4IBDwAwggEKAoIBAQCbd07kkeYm26ElOf0vk2gbacI4f+Mh\nknHZ4rFcqe3Xnsl1LrifRRhPhvl1mPOiax15UGvExpIjVToxV7Ivflwf0w36YTJf\nCnQbQmqfjdy+yjSZeGF94cwPw3tq4BxFBwxRrnV0Tx/cmrNNNLtA49PjfV0G+8G2\nNgBgeAh8uThLO8dOfSwfC/+JN0vRNjsC63Fk5f0t0jBAncQOl9Y0zStb4oMGfMow\njrBhcw7M4nQFD6XhwrUvNT9scFVrmywu/3W/Ky5vOvroht7Wlyi99BYvTGiDY9Te\nXCrPr3zEJR2FRQFCJu9yIoxDyQ/06453H/UFfnRYPNWgfWgkfqzRe91pAgMBAAGj\nJjAkMBIGA1UdEwEB/wQIMAYBAf8CAQAwDgYDVR0PAQH/BAQDAgEGMA0GCSqGSIb3\nDQEBCwUAA4IBAQAByJYRRPn0Iph/84lRxXdFdWJnPEujg2ki0ZnNGdvBtk4ypXkJ\nGORYdyY5uZjTRCLfJV6YMUk+7MSxqcV0XwkFc96LdGlhEWV4+AJqHlGQNET09Umk\nzXqBGZXSfx9fDsN0kKk3q/nE/LYwwkxYQRaScViwiuke/uJrni1oV5Al0WwjbXrS\n7/3+x70a4ANj53mw3M/g2PjC5LWY1dIYbK+jMo6NFFXrvyf0CUMVAefQB/n1/kmc\nqSnxEGQ21TqdE2ngscUeP2WOoVwFktyOi5qL+yifI7cBC3SqQh4Eq24vwvtQofqK\nZaeIbRUAoJjhZP/4oO91wX3iXrzpBjLKHuKl\n-----END CERTIFICATE-----",
    "-----BEGIN CERTIFICATE-----\nMIIC3DCCAcSgAwIBAgIBETANBgkqhkiG9w0BAQsFADAfMR0wGwYDVQQDExRvdGhl\nci1jbG91ZC1yb290LXJzYTAeFw0yNjAxMDEwMDAwMDBaFw0yNzAxMDEwMDAwMDBa\nMB8xHTAbBgNVBAMTFG90aGVyLWNsb3VkLXJvb3QtcnNhMIIBIjANBgkqhkiG9w0B\nAQEFAAOCAQ8AMIIBCgKCAQEAlb4LitusJYhb125f28pLDoqci0yPts9lwlx7hWRt\nDQ7PNItdbPD1T8WRrxgiARsKP05asmUPQPmVp0p9QQzDUduGJL+P11znWPtiTffm\nkm3SOG30vzmj3vI9fBDCupiZ1zWFfMVk1e1+1ltmTW93fPCU9GaOUyjNyU/veut3\nVUiXnjQLGwJtk9cuaxYq+a27H3Mbf9z9SaUpiflOAfFX/6HeKrdHSD+UjMNTxAE/\nHGzpGr9F2GRkoosHIEjXj7Eu9GoTLvSKrUtHjyK52Lma5WXcJ83I/z8klTVWpdEP\nfpF1wm2owVsUPfKvi+R0WXchHMUw15ZfAt/Qb38roP4FOwIDAQABoyMwITAPBgNV\nHRMBAf8EBTADAQH/MA4GA1UdDwEB/wQEAwIBBjANBgkqhkiG9w0BAQsFAAOCAQEA\njQpYh3vcQFE5KcpcftPohKWTlzbiClfN8jtLaaqPr55HZAK2VOrWtL5WOpKWlbUr\nu/gFLa7+tWd7WlvWLMFCSLDmqUe1bImP42tn+z6JNoX3BWZhXfSVUm8KdMSZkq7d\nbP1WtYYsAcDCpnVFdvzNRvfe0XP8tqvffYs87t1xPLD+06KswLQ5DkrI8GWYSc9Y\nQ1RQJ8G9YdLZJ8qd78I5whdy64Ef5vcKJqxfiOtSgydQWln7xZkThINbdkbK4aAe\nhyL19fWx1irfD1Dz/BCcBSxb0kPeC8Oa1OcsSPSltW1DyaIFhVljbB2v75I0vhqt\nOUSKpHFtRfc/PR9i6Wmx+A==\n-----END CERTIFICATE-----"
  ]
}
