{
  "version": "1",
  "kind": "DeploymentEvidence",
  "hostname": "router.example.test",
  "issuedAt": "2026-01-15T11:55:00.000Z",
  "certFingerprint": "sha256/kaSfsK_ELJqBEFszox7TLeH2GmtTxfRLQexPcmZOED4",
  "jws": "eyJhbGciOiJFUzI1NksifQ.eyJ2ZXJzaW9uIjoiMSIsImhvc3RuYW1lIjoicm91dGVyLmV4YW1wbGUudGVzdCIsImlzc3VlZEF0IjoiMjAyNi0wMS0xNVQxMTo1NTowMC4wMDBaIiwiY2VydEZpbmdlcnByaW50Ijoic2hhMjU2L2thU2ZzS19FTEpxQkVGc3pveDdUTGVIMkdtdFR4ZlJMUWV4UGNtWk9FRDQiLCJraW5kIjoiRGVwbG95bWVudEV2aWRlbmNlIiwiZXZpZGVuY2VEaWdlc3QiOiJzaGEyNTYvd2VNZHlDbjNWTlVvc1YwTXhmNlAxRDhpV0dYVnlUWl9kLTV2RVc0UTlxcyIsImV2aWRlbmNlIjp7InZlcnNpb24iOjIsInJlc291cmNlcyI6W3sia2luZCI6IkRlcGxveW1lbnQiLCJuYW1lIjoicm91dGVyLWFwaSIsIm5hbWVzcGFjZSI6ImNvbmZpZGVudGlhbC1yb3V0ZXIiLCJjb250YWluZXJzIjpbeyJuYW1lIjoicm91dGVyLWFwaSIsImltYWdlIjoiZ2hjci5pby9zdXBlci1wcm90b2NvbC9yb3V0ZXItYXBpQHNoYTI1NjoxMTExMTExMTExMTExMTExMTExMTExMTExMTExMTExMTExMTExMTExMTExMTExMTExMTExMTExMTExMTExMTExIn1dfSx7ImtpbmQiOiJEZXBsb3ltZW50IiwibmFtZSI6ImxpdGVsbG0iLCJuYW1lc3BhY2UiOiJjb25maWRlbnRpYWwtcm91dGVyIiwiY29udGFpbmVycyI6W3sibmFtZSI6ImxpdGVsbG0iLCJpbWFnZSI6ImdoY3IuaW8vYmVycmlhaS9saXRlbGxtQHNoYTI1NjoyMjIyMjIyMjIyMjIyMjIyMjIyMjIyMjIyMjIyMjIyMjIyMjIyMjIyMjIyMjIyMjIyMjIyMjIyMjIyMjIyMjIyIn1dfV19fQ.0_HI533YGHM48kXdINGyu0UNiyjyRZsXGRCVCgTWMFjDlQacT3Hg3mOq8tl_gndAT4uhQOR7I3APPKm4NyRLvw",
  "certChain": [
    "-----BEGIN CERTIFICATE-----\nMIIBmTCCAT+gAwIBAgIBIzAKBggqhkjOPQQDAjAzMTEwLwYDVQQDEyhjb25maWRl\nbnRpYWwtcm91dGVyLXRlc3QtaW50ZXJtZWRpYXRlLWVjMB4XDTI2MDEwMTAwMDAw\nMFoXDTI3MDEwMTAwMDAwMFowHjEcMBoGA1UEAxMTcm91dGVyLmV4YW1wbGUudGVz\ndDBWMBAGByqGSM49AgEGBSuBBAAKA0IABMfw9NFYTvI+C26LxVOnMb98c8M6jbdL\nP5sYiXp2GoMUqgWdMGylZnnguX3s8I4l5/BkccMG8x3qs3VrEIzU3vWjXDBaMAkG\nA1UdEwQCMAAwDgYDVR0PAQH/BAQDAgWgMB0GA1UdJQQWMBQGCCsGAQUFBwMBBggr\nBgEFBQcDAjAeBgNVHREEFzAVghNyb3V0ZXIuZXhhbXBsZS50ZXN0MAoGCCqGSM49\nBAMCA0gAMEUCIQD4UCLIgm8JAtv1a7Wd2Ra17sAOGYMv7fEeD78vYYvLBgIgUqmV\nQjjnECSPJNo6l1KCdSyirzETIhbhm/wqe1DYmyw=\n-----END CERTIFICATE-----",
    "-----BEGIN CERTIFICATE-----\nMIIBcDCCARagAwIBAgIBIjAKBggqhkjOPQQDAjArMSkwJwYDVQQDEyBjb25maWRl\nbnRpYWwtcm91dGVyLXRlc3Qtcm9vdC1lYzAeFw0yNjAxMDEwMDAwMDBaFw0yNzAx\nMDEwMDAwMDBaMDMxMTAvBgNVBAMTKGNvbmZpZGVudGlhbC1yb3V0ZXItdGVzdC1p\nbnRlcm1lZGlhdGUtZWMwVjAQBgcqhkjOPQIBBgUrgQQACgNCAARpRKCMsWMQsJMh\n2CD4QtG/nt7iNRqppQnqKbM5w3/mVw9PhGpMktRjBzxWswAM1ms+hYZlE7Tj+QQo\n/KqldSB/oyYwJDASBgNVHRMBAf8ECDAGAQH/AgEAMA4GA1UdDwEB/wQEAwIBBjAK\nBggqhkjOPQQDAgNIADBFAiEA25xM1OrQJqZrmrm/ygZcyvQCguMRVE9N/BZJby/u\nPQcCIHS+5TdDgY3UKtv7b/adRbIiYnVCOBUm61KCxWdJz32J\n-----END CERTIFICATE-----",
    "-----BEGIN CERTIFICATE-----\nMIIBZDCCAQugAwIBAgIBITAKBggqhkjOPQQDAjArMSkwJwYDVQQDEyBjb25maWRl\nbnRpYWwtcm91dGVyLXRlc3Qtcm9vdC1lYzAeFw0yNjAxMDEwMDAwMDBaFw0yNzAx\nMDEwMDAwMDBaMCsxKTAnBgNVBAMTIGNvbmZpZGVudGlhbC1yb3V0ZXItdGVzdC1y\nb290LWVjMFYwEAYHKoZIzj0CAQYFK4EEAAoDQgAEmB06oHY0ODKpXduzjpyxjGqK\n08TJSbcR1mMZ7gIOXwqmkGIwwdr3Ve/LHBTQa2G3225b3I8bLOy8Yxz31pceJKMj\nMCEwDwYDVR0TAQH/BAUwAwEB/zAOBgNVHQ8BAf8EBAMCAQYwCgYIKoZIzj0EAwID\nRwAwRAIgDxV/kakk5KeXnc2nCh83Y4v7AbvJOTJWX8gT6Xo/V/oCIHUKsfWInSwj\nSM/QhR6e1rCx1/ucouZlydTP7Nxn3X5y\n-----END CERTIFICATE-----"
  ]
}
