{
  "version": "1",
  "kind": "DeploymentEvidence",
  "hostname": "router.example.test",
  "issuedAt": "2026-01-15T11:55:00.000Z",
  "certFingerprint": "sha256/Se8jXZF8g0TUIW9B8vlKqiqFd47GzRmRFfMOB-gOF7M",
  "jws": "eyJhbGciOiJFUzI1NksifQ.eyJ2ZXJzaW9uIjoiMSIsImhvc3RuYW1lIjoicm91dGVyLmV4YW1wbGUudGVzdCIsImlzc3VlZEF0IjoiMjAyNi0wMS0xNVQxMTo1NTowMC4wMDBaIiwiY2VydEZpbmdlcnByaW50Ijoic2hhMjU2L1NlOGpYWkY4ZzBUVUlXOUI4dmxLcWlxRmQ0N0d6Um1SRmZNT0ItZ09GN00iLCJraW5kIjoiRGVwbG95bWVudEV2aWRlbmNlIiwiZXZpZGVuY2VEaWdlc3QiOiJzaGEyNTYvd2VNZHlDbjNWTlVvc1YwTXhmNlAxRDhpV0dYVnlUWl9kLTV2RVc0UTlxcyIsImV2aWRlbmNlIjp7InZlcnNpb24iOjIsInJlc291cmNlcyI6W3sia2luZCI6IkRlcGxveW1lbnQiLCJuYW1lIjoicm91dGVyLWFwaSIsIm5hbWVzcGFjZSI6ImNvbmZpZGVudGlhbC1yb3V0ZXIiLCJjb250YWluZXJzIjpbeyJuYW1lIjoicm91dGVyLWFwaSIsImltYWdlIjoiZ2hjci5pby9zdXBlci1wcm90b2NvbC9yb3V0ZXItYXBpQHNoYTI1NjoxMTExMTExMTExMTExMTExMTExMTExMTExMTExMTExMTExMTExMTExMTExMTExMTExMTExMTExMTExMTExMTExIn1dfSx7ImtpbmQiOiJEZXBsb3ltZW50IiwibmFtZSI6ImxpdGVsbG0iLCJuYW1lc3BhY2UiOiJjb25maWRlbnRpYWwtcm91dGVyIiwiY29udGFpbmVycyI6W3sibmFtZSI6ImxpdGVsbG0iLCJpbWFnZSI6ImdoY3IuaW8vYmVycmlhaS9saXRlbGxtQHNoYTI1NjoyMjIyMjIyMjIyMjIyMjIyMjIyMjIyMjIyMjIyMjIyMjIyMjIyMjIyMjIyMjIyMjIyMjIyMjIyMjIyMjIyMjIyIn1dfV19fQ.ksIgMYDpJkk4KSJXscVMDuAwevRkC1pAkp0mLcfKpbdlayWBKhiEUSYitpIjQ2LsDalpMwCgLOKOXMY-iG1O5w",
  "certChain": [
    "-----BEGIN CERTIFICATE-----\nMIIBoDCCAUagAwIBAgIBJjAKBggqhkjOPQQDAjA6MTgwNgYDVQQDEy9jb25maWRl\nbnRpYWwtcm91dGVyLXRlc3QtaW50ZXJtZWRpYXRlLWVjLWhpZ2gtczAeFw0yNjAx\nMDEwMDAwMDBaFw0yNzAxMDEwMDAwMDBaMB4xHDAaBgNVBAMTE3JvdXRlci5leGFt\ncGxlLnRlc3QwVjAQBgcqhkjOPQIBBgUrgQQACgNCAATH8PTRWE7yPgtui8VTpzG/\nfHPDOo23Sz+bGIl6dhqDFKoFnTBspWZ54Ll97PCOJefwZHHDBvMd6rN1axCM1N71\no1wwWjAJBgNVHRMEAjAAMA4GA1UdDwEB/wQEAwIFoDAdBgNVHSUEFjAUBggrBgEF\nBQcDAQYIKwYBBQUHAwIwHgYDVR0RBBcwFYITcm91dGVyLmV4YW1wbGUudGVzdDAK\nBggqhkjOPQQDAgNIADBFAiB6qKD1Wrp5avg7S6EYWNj8F2421qwtwUFRr4uDq92L\nFAIhAPHKQY+r5JZseIlzc02wURC/wiyh/f4Ajy8YngAk4mt0\n-----END CERTIFICATE-----",
    "-----BEGIN CERTIFICATE-----\nMIIBfzCCASSgAwIBAgIBJTAKBggqhkjOPQQDAjAyMTAwLgYDVQQDEydjb25maWRl\nbnRpYWwtcm91dGVyLXRlc3Qtcm9vdC1lYy1oaWdoLXMwHhcNMjYwMTAxMDAwMDAw\nWhcNMjcwMTAxMDAwMDAwWjA6MTgwNgYDVQQDEy9jb25maWRlbnRpYWwtcm91dGVy\nLXRlc3QtaW50ZXJtZWRpYXRlLWVjLWhpZ2gtczBWMBAGByqGSM49AgEGBSuBBAAK\nA0IABGlEoIyxYxCwkyHYIPhC0b+e3uI1GqmlCeopsznDf+ZXD0+EakyS1GMHPFaz\nAAzWaz6FhmUTtOP5BCj8qqV1IH+jJjAkMBIGA1UdEwEB/wQIMAYBAf8CAQAwDgYD\nVR0PAQH/BAQDAgEGMAoGCCqGSM49BAMCA0kAMEYCIQDihnVYEeRkH3LQXO+l5KVH\n6LFWZsswwNJCIr6vEbR2BAIhAIIxAYYmy8mvfvCGf0UD5UZVhnBYq5fFKdDBX++6\nEVJ1\n-----END CERTIFICATE-----",
    "-----BEGIN CERTIFICATE-----\nMIIBczCCARmgAwIBAgIBJDAKBggqhkjOPQQDAjAyMTAwLgYDVQQDEydjb25maWRl\nbnRpYWwtcm91dGVyLXRlc3Qtcm9vdC1lYy1oaWdoLXMwHhcNMjYwMTAxMDAwMDAw\nWhcNMjcwMTAxMDAwMDAwWjAyMTAwLgYDVQQDEydjb25maWRlbnRpYWwtcm91dGVy\nLXRlc3Qtcm9vdC1lYy1oaWdoLXMwVjAQBgcqhkjOPQIBBgUrgQQACgNCAASYHTqg\ndjQ4Mqld27OOnLGMaorTxMlJtxHWYxnuAg5fCqaQYjDB2vdV78scFNBrYbfbblvc\njxss7LxjHPfWlx4koyMwITAPBgNVHRMBAf8EBTADAQH/MA4GA1UdDwEB/wQEAwIB\nBjAKBggqhkjOPQQDAgNIADBFAiATd2qvY2dwMe/kBhu+MXWQqh5HNtARbh6BKKB1\ntG2xUAIhANaapqwQfzYNNpdEXGzwNNNdIh9vWqITkA1oq5Ly8UKO\n-----END CERTIFICATE-----"
  ]
}
