{
  "version": "1",
  "kind": "DeploymentEvidence",
  "hostname": "router.example.test",
  "issuedAt": "2026-01-15T11:55:00.000Z",
  "certFingerprint": "sha256/d4d-LKXzAIf1DOWon1SzGssmcjKrG1k2hQ-NiU5z_z8",
  "jws": "eyJhbGciOiJSUzI1NiJ9.eyJ2ZXJzaW9uIjoiMSIsImhvc3RuYW1lIjoicm91dGVyLmV4YW1wbGUudGVzdCIsImlzc3VlZEF0IjoiMjAyNi0wMS0xNVQxMTo1NTowMC4wMDBaIiwiY2VydEZpbmdlcnByaW50Ijoic2hhMjU2L2Q0ZC1MS1h6QUlmMURPV29uMVN6R3NzbWNqS3JHMWsyaFEtTmlVNXpfejgiLCJraW5kIjoiRGVwbG95bWVudEV2aWRlbmNlIiwiZXZpZGVuY2VEaWdlc3QiOiJzaGEyNTYvd2VNZHlDbjNWTlVvc1YwTXhmNlAxRDhpV0dYVnlUWl9kLTV2RVc0UTlxcyIsImV2aWRlbmNlIjp7InZlcnNpb24iOjIsInJlc291cmNlcyI6W3sia2luZCI6IkRlcGxveW1lbnQiLCJuYW1lIjoicm91dGVyLWFwaSIsIm5hbWVzcGFjZSI6ImNvbmZpZGVudGlhbC1yb3V0ZXIiLCJjb250YWluZXJzIjpbeyJuYW1lIjoicm91dGVyLWFwaSIsImltYWdlIjoiZ2hjci5pby9zdXBlci1wcm90b2NvbC9yb3V0ZXItYXBpQHNoYTI1NjoxMTExMTExMTExMTExMTExMTExMTExMTExMTExMTExMTExMTExMTExMTExMTExMTExMTExMTExMTExMTExMTExIn1dfSx7ImtpbmQiOiJEZXBsb3ltZW50IiwibmFtZSI6ImxpdGVsbG0iLCJuYW1lc3BhY2UiOiJjb25maWRlbnRpYWwtcm91dGVyIiwiY29udGFpbmVycyI6W3sibmFtZSI6ImxpdGVsbG0iLCJpbWFnZSI6ImdoY3IuaW8vYmVycmlhaS9saXRlbGxtQHNoYTI1NjoyMjIyMjIyMjIyMjIyMjIyMjIyMjIyMjIyMjIyMjIyMjIyMjIyMjIyMjIyMjIyMjIyMjIyMjIyMjIyMjIyMjIyIn1dfV19fQ.nXBZrTR_5oU4yg-7jnRBuQG2wxIaYt09cRp9YNJIjENrIx_svZSqiJrXXmSOqTx9jBj7Dd5PILe-t-01RhnTD-OJ5p04yeX9K10s3f439mmBBF2tCz5m_OutCtqQUh9Y1fWU5SPofaWk6bkbyLVjwkeYU4_HKucE-eugG78ldYsqUu-YJFOkREOeTi8xV_69LEvn1IKReFBc3YivRnyl1DAMv8kBqmK3c2mjvsoHOl1W2ydeKq2HCanI0kpVVwj8iY6H6EGEssM41A_d1FKCLUd2HFp5b3M_hAqIKzehT6iwuKHQryYVTdmERaDDThdg3pAxp2uSop9ZWf-eQYs9HQ",
  "certChain": [
    "-----BEGIN CERTIFICATE-----\nMIIDKTCCAhGgAwIBAgIBAzANBgkqhkiG9w0BAQsFADA0MTIwMAYDVQQDEyljb25m\naWRlbnRpYWwtcm91dGVyLXRlc3QtaW50ZXJtZWRpYXRlLXJzYTAeFw0yNjAxMDEw\nMDAwMDBaFw0yNzAxMDEwMDAwMDBaMB4xHDAaBgNVBAMTE3JvdXRlci5leGFtcGxl\nLnRlc3QwggEiMA0GCSqGSIb3DQEBAQUAA4IBDwAwggEKAoIBAQCtcMqJAU4jhDQr\n4tWmhF3F/bDxOANS0OSzIY++hxtjjlbbMQ/4e/Ws6N1vpKy1pxCIdqHH0FiuMApM\n5cquuhCWDq8lypeJwEBkOQvZ5nBGXh2UqM9X8ksJ7d59Co8f88pXqNLOFgdfpdzx\neRgqF1ZcvsFs/KdEsVzYdeDZXgq1ZG8W9bTFUqKFMenxsJD2PhDPox6r70XWMI/g\n5HRP5rc331yJOyEFFu683wCmdfZar6vILFmpEiKvJhXxhNMoKjCb7onp7H2nZae1\n6s08FeKT2PUROHqgGtWkfUzsYfvZJ2YyspX5hCOjiX3aR9tCFD2ozpKA9W9dBvUr\nk4arh/5zAgMBAAGjXDBaMAkGA1UdEwQCMAAwDgYDVR0PAQH/BAQDAgWgMB0GA1Ud\nJQQWMBQGCCsGAQUFBwMBBggrBgEFBQcDAjAeBgNVHREEFzAVghNyb3V0ZXIuZXhh\nbXBsZS50ZXN0MA0GCSqGSIb3DQEBCwUAA4IBAQBh9M4nDHPDF8MpxBVyqM4QoT7V\nMJDHJCjOr99hnEUaX23JwvI7sgVORmVO3LrtNsHcrL2eFCicyDi2Tl42lg4Ec/Xa\nUDnafigqaU/BzOJF/bmydmhQlgc6HyLONiTMrgvxzcixQN/zabWqv9ppuGmqQ59Y\nUomOw8VWsdLw1tTyt5hpyeZVqR82UDPdNs2lLheB7Icf5bF/mF9LOseIGtfeVhDy\nCcBqpGZJ8YiPS+SKIHEZtT5644ht4iiLFJrUacZVh4PTiA3GjIAG9TutpjiMhe3f\nnGTwt7M8Z1t/wy2/P/2VWa0G67ldJMSP9Rk7yzjgqeifQ2a+uYWnnxzXZV3K\n-----END CERTIFICATE-----",
    "-----BEGIN CERTIFICATE-----\nMIIC5zCCAc+gAwIBAgIBEjANBgkqhkiG9w0BAQsFADAfMR0wGwYDVQQDExRvdGhl\nci1jbG91ZC1yb290LXJzYTAeFw0yNjAxMDEwMDAwMDBaFw0yNzAxMDEwMDAwMDBa\nMCcxJTAjBgNVBAMTHG90aGVyLWNsb3VkLWludGVybWVkaWF0ZS1yc2EwggEiMA0G\nCSqGSIb3DQEBAQUAA4IBDwAwggEKAoIBAQCbd07kkeYm26ElOf0vk2gbacI4f+Mh\nknHZ4rFcqe3Xnsl1LrifRRhPhvl1mPOiax15UGvExpIjVToxV7Ivflwf0w36YTJf\nCnQbQmqfjdy+yjSZeGF94cwPw3tq4BxFBwxRrnV0Tx/cmrNNNLtA49PjfV0G+8G2\nNgBgeAh8uThLO8dOfSwfC/+JN0vRNjsC63Fk5f0t0jBAncQOl9Y0zStb4oMGfMow\njrBhcw7M4nQFD6XhwrUvNT9scFVrmywu/3W/Ky5vOvroht7Wlyi99BYvTGiDY9Te\nXCrPr3zEJR2FRQFCJu9yIoxDyQ/06453H/UFfnRYPNWgfWgkfqzRe91pAgMBAAGj\nJjAkMBIGA1UdEwEB/wQIMAYBAf8CAQAwDgYDVR0PAQH/BAQDAgEGMA0GCSqGSIb3\nDQEBCwUAA4IBAQAByJYRRPn0Iph/84lRxXdFdWJnPEujg2ki0ZnNGdvBtk4ypXkJ\nGORYdyY5uZjTRCLfJV6YMUk+7MSxqcV0XwkFc96LdGlhEWV4+AJqHlGQNET09Umk\nzXqBGZXSfx9fDsN0kKk3q/nE/LYwwkxYQRaScViwiuke/uJrni1oV5Al0WwjbXrS\n7/3+x70a4ANj53mw3M/g2PjC5LWY1dIYbK+jMo6NFFXrvyf0CUMVAefQB/n1/kmc\nqSnxEGQ21TqdE2ngscUeP2WOoVwFktyOi5qL+yifI7cBC3SqQh4Eq24vwvtQofqK\nZaeIbRUAoJjhZP/4oO91wX3iXrzpBjLKHuKl\n-----END CERTIFICATE-----",
    "-----BEGIN CERTIFICATE-----\nMIIC3DCCAcSgAwIBAgIBETANBgkqhkiG9w0BAQsFADAfMR0wGwYDVQQDExRvdGhl\nci1jbG91ZC1yb290LXJzYTAeFw0yNjAxMDEwMDAwMDBaFw0yNzAxMDEwMDAwMDBa\nMB8xHTAbBgNVBAMTFG90aGVyLWNsb3VkLXJvb3QtcnNhMIIBIjANBgkqhkiG9w0B\nAQEFAAOCAQ8AMIIBCgKCAQEAlb4LitusJYhb125f28pLDoqci0yPts9lwlx7hWRt\nDQ7PNItdbPD1T8WRrxgiARsKP05asmUPQPmVp0p9QQzDUduGJL+P11znWPtiTffm\nkm3SOG30vzmj3vI9fBDCupiZ1zWFfMVk1e1+1ltmTW93fPCU9GaOUyjNyU/veut3\nVUiXnjQLGwJtk9cuaxYq+a27H3Mbf9z9SaUpiflOAfFX/6HeKrdHSD+UjMNTxAE/\nHGzpGr9F2GRkoosHIEjXj7Eu9GoTLvSKrUtHjyK52Lma5WXcJ83I/z8klTVWpdEP\nfpF1wm2owVsUPfKvi+R0WXchHMUw15ZfAt/Qb38roP4FOwIDAQABoyMwITAPBgNV\nHRMBAf8EBTADAQH/MA4GA1UdDwEB/wQEAwIBBjANBgkqhkiG9w0BAQsFAAOCAQEA\njQpYh3vcQFE5KcpcftPohKWTlzbiClfN8jtLaaqPr55HZAK2VOrWtL5WOpKWlbUr\nu/gFLa7+tWd7WlvWLMFCSLDmqUe1bImP42tn+z6JNoX3BWZhXfSVUm8KdMSZkq7d\nbP1WtYYsAcDCpnVFdvzNRvfe0XP8tqvffYs87t1xPLD+06KswLQ5DkrI8GWYSc9Y\nQ1RQJ8G9YdLZJ8qd78I5whdy64Ef5vcKJqxfiOtSgydQWln7xZkThINbdkbK4aAe\nhyL19fWx1irfD1Dz/BCcBSxb0kPeC8Oa1OcsSPSltW1DyaIFhVljbB2v75I0vhqt\nOUSKpHFtRfc/PR9i6Wmx+A==\n-----END CERTIFICATE-----"
  ]
}
