{
  "version": "1",
  "kind": "DeploymentEvidence",
  "hostname": "router.example.test",
  "issuedAt": "2026-01-15T11:55:00.000Z",
  "certFingerprint": "sha256/Y0lxujh625qtK-gkvyPLwnKpDFGcp8KRfHgNCWcvr2U",
  "jws": "eyJhbGciOiJSUzI1NiJ9.eyJ2ZXJzaW9uIjoiMSIsImhvc3RuYW1lIjoicm91dGVyLmV4YW1wbGUudGVzdCIsImlzc3VlZEF0IjoiMjAyNi0wMS0xNVQxMTo1NTowMC4wMDBaIiwiY2VydEZpbmdlcnByaW50Ijoic2hhMjU2L1kwbHh1amg2MjVxdEstZ2t2eVBMd25LcERGR2NwOEtSZkhnTkNXY3ZyMlUiLCJraW5kIjoiRGVwbG95bWVudEV2aWRlbmNlIiwiZXZpZGVuY2VEaWdlc3QiOiJzaGEyNTYvd2VNZHlDbjNWTlVvc1YwTXhmNlAxRDhpV0dYVnlUWl9kLTV2RVc0UTlxcyIsImV2aWRlbmNlIjp7InZlcnNpb24iOjIsInJlc291cmNlcyI6W3sia2luZCI6IkRlcGxveW1lbnQiLCJuYW1lIjoicm91dGVyLWFwaSIsIm5hbWVzcGFjZSI6ImNvbmZpZGVudGlhbC1yb3V0ZXIiLCJjb250YWluZXJzIjpbeyJuYW1lIjoicm91dGVyLWFwaSIsImltYWdlIjoiZ2hjci5pby9zdXBlci1wcm90b2NvbC9yb3V0ZXItYXBpQHNoYTI1NjoxMTExMTExMTExMTExMTExMTExMTExMTExMTExMTExMTExMTExMTExMTExMTExMTExMTExMTExMTExMTExMTExIn1dfSx7ImtpbmQiOiJEZXBsb3ltZW50IiwibmFtZSI6ImxpdGVsbG0iLCJuYW1lc3BhY2UiOiJjb25maWRlbnRpYWwtcm91dGVyIiwiY29udGFpbmVycyI6W3sibmFtZSI6ImxpdGVsbG0iLCJpbWFnZSI6ImdoY3IuaW8vYmVycmlhaS9saXRlbGxtQHNoYTI1NjoyMjIyMjIyMjIyMjIyMjIyMjIyMjIyMjIyMjIyMjIyMjIyMjIyMjIyMjIyMjIyMjIyMjIyMjIyMjIyMjIyMjIyIn1dfV19fQ.DCTweGr_HRRRUQ1TSbki09kIwLXFMbpf5P0s6QbJd4O1lQylfl3FNPYz1xHKjAcrA6barbZuFO9pilgXLwPr37mPYQ6iTqI3ZH1gQitPxuPY8ZGhEJx3HWgH93wYf1ae0XvRDV8J6ZSvEozxu3v4fkg01FZ7-94pURL_exGUwqSXsItFZbcL8CfcZPGWgjQGEYuIstb-OFYhBhKmfh_lUtVdZGNQM-IuE6agcHJgXoPZe8Q4ge5TSFttnpcWDuax0tnf0-KBzYXGcVDp8wvS4A_TQanjpFADXLG5daeVHA-ExAg41gLeQaJW2HP3csKWat8ILkmAGXVUbRLL9FQ9QQ",
  "certChain": [
    "-----BEGIN CERTIFICATE-----\nMIIDKTCCAhGgAwIBAgIBAzANBgkqhkiG9w0BAQsFADA0MTIwMAYDVQQDEyljb25m\naWRlbnRpYWwtcm91dGVyLXRlc3QtaW50ZXJtZWRpYXRlLXJzYTAeFw0yNjAxMDEw\nMDAwMDBaFw0yNzAxMDEwMDAwMDBaMB4xHDAaBgNVBAMTE3JvdXRlci5leGFtcGxl\nLnRlc3QwggEiMA0GCSqGSIb3DQEBAQUAA4IBDwAwggEKAoIBAQCtcMqJAU4jhDQr\n4tWmhF3F/bDxOANS0OSzIY++hxtjjlbbMQ/4e/Ws6N1vpKy1pxCIdqHH0FiuMApM\n5cquuhCWDq8lypeJwEBkOQvZ5nBGXh2UqM9X8ksJ7d59Co8f88pXqNLOFgdfpdzx\neRgqF1ZcvsFs/KdEsVzYdeDZXgq1ZG8W9bTFUqKFMenxsJD2PhDPox6r70XWMI/g\n5HRP5rc331yJOyEFFu683wCmdfZar6vILFmpEiKvJhXxhNMoKjCb7onp7H2nZae1\n6s08FeKT2PUROHqgGtWkfUzsYfvZJ2YyspX5hCOjiX3aR9tCFD2ozpKA9W9dBvUr\nk4arh/5zAgMBAAGjXDBaMAkGA1UdEwQCMAAwDgYDVR0PAQH/BAQDAgWgMB0GA1Ud\nJQQWMBQGCCsGAQUFBwMBBggrBgEFBQcDAjAeBgNVHREEFzAVghNyb3V0ZXIuZXhh\nbXBsZS50ZXN0MA0GCSqGSIb3DQEBCwUAA4IBAQBh9M4nDHPDF8MpxBVyqM4QoT7V\nMJDHJCjOr99hnEUaX23JwvI7sgVORmVO3LrtNsHcrL2eFCicyDi2Tl42lg4Ec/Xa\nUDnafigqaU/BzOJF/bmydmhQlgc6HyLONiTMrgvxzcixQN/zabWqv9ppuGmqQ59Y\nUomOw8VWsdLw1tTyt5hpyeZVqR82UDPdNs2lLheB7Icf5bF/mF9LOseIGtfeVhDy\nCcBqpGZJ8YiPS+SKIHEZtT5644ht4iiLFJrUacZVh4PTiA3GjIAG9TutpjiMhe3f\nnGTwt7M8Z1t/wy2/P/2VWa0G67ldJMSP9Rk7yzjgqeifQ2a+uYWnnxzXZV3K\n-----END CERTIFICATE-----",
    "-----BEGIN CERTIFICATE-----\nMIIDATCCAemgAwIBAgIBAjANBgkqhkiG9w0BAQsFADAsMSowKAYDVQQDEyFjb25m\naWRlbnRpYWwtcm91dGVyLXRlc3Qtcm9vdC1yc2EwHhcNMjYwMTAxMDAwMDAwWhcN\nMjcwMTAxMDAwMDAwWjA0MTIwMAYDVQQDEyljb25maWRlbnRpYWwtcm91dGVyLXRl\nc3QtaW50ZXJtZWRpYXRlLXJzYTCCASIwDQYJKoZIhvcNAQEBBQADggEPADCCAQoC\nggEBAKklJ0BrVVPEhR/gxE5NdPjV8PVORlUR+J3U99jvM44JPwpXGgROpFXsxVPa\n8/cW+63dEtkdrrrE1T4Tw5mxvL6vfGLAp/kMkpExgdVk5EfutKtEXoaEC7VHAzBT\nP4TmhYCE3foS9qrerN7EpsBzDj+1lLnBw45lreuSU4hVFZH0Fh56iSJlM98erh3x\nhb9jK0PSIt3HUrx9UVoqYOIg/Jao/yOvuNyE4f7bciiBX/DUg5PfecutBGi+g7yn\nJDG1tf+8lcXNCHVsZ3NMw1/JErc2a0iNi3oiOeWByXmeYziO69aOUXB9rWqRrn/4\nd1w+2y+ur24aLZ/sCVkJooM50cUCAwEAAaMmMCQwEgYDVR0TAQH/BAgwBgEB/wIB\nADAOBgNVHQ8BAf8EBAMCAQYwDQYJKoZIhvcNAQELBQADggEBAJI5RWYdczY3KcHO\njFj5XExvXlv5C1d04ZnrR3DQ0ffB3mNLF0nmMgi6eYsgWj0GheQo10HrKwj/TAN5\nj1F/2OviwrHNXjMkOmGEUDs3ENSqWdoFLB2xg8gxUrtPF8p3ckiXQxvrS1ZdcIkP\neFILYUvNeZTpsmYeLXQtsKhetAlZAVhcW7lFiMculzxWSU+j+upcHUbNYTzMILIk\nzbONvo5kIbIm15532XSXsa/npc4ieroGkWgnonSbo71UcI7AJB+BnhVKQKpAOiT6\nqu50kgFTKvDNgK/DI9i1ChdlCEs6eKFXuC8AFSdHsudV8XjMBR5dbEi/TOzUteO6\n+Xsp6y0=\n-----END CERTIFICATE-----",
    "-----BEGIN CERTIFICATE-----\nMIIC9jCCAd6gAwIBAgIBATANBgkqhkiG9w0BAQsFADAsMSowKAYDVQQDEyFjb25m\naWRlbnRpYWwtcm91dGVyLXRlc3Qtcm9vdC1yc2EwHhcNMjYwMTAxMDAwMDAwWhcN\nMjcwMTAxMDAwMDAwWjAsMSowKAYDVQQDEyFjb25maWRlbnRpYWwtcm91dGVyLXRl\nc3Qtcm9vdC1yc2EwggEiMA0GCSqGSIb3DQEBAQUAA4IBDwAwggEKAoIBAQC6hiHK\nRFQHYsbS5JLuPoNp2zPVsvRuhtv6vtUR6PXFBnm5WPOJISWvJ2d3MYJjFaFekETR\nGz4jymCGwoG14WnlR4o2SXpnteqGbKhW62AqDafdZ+HUnus2o8pIiaiqZ4NkDTKC\n660IUUA9oCkFx/5LKjHPHao1hyIosHZuAuyKl3gx2QcyoCmjiXYQ6wklOZCVm7QK\nbb2z0buXZygrDvz5sz3ZmAmUlcIl70NIR6h0pX796y/5GQSepLRnL0StUA2D6Qyz\nl8nkcMvA8wNc2v/ztJ9FTAP/nWK7JK6MbHgrCZYkIf0YOW+OkkbJF0uUMDHibjI1\nqJg1MQWNl9OZs0NbAgMBAAGjIzAhMA8GA1UdEwEB/wQFMAMBAf8wDgYDVR0PAQH/\nBAQDAgEGMA0GCSqGSIb3DQEBCwUAA4IBAQCSq6wVI49gU3isMkfvwSLp4n/BAjeE\n95u17dkJ3wsqo5gUG4uC8zTYQP0GsgouK71ncD7ur7t1l5/olzlz/m1J+OZvdQoa\npkPCCHBo8pGoF79eSs3+YEpyiwRC6jfNF5r7u9V1EVSGoZUaij7OBzA3UHpzl7SV\nowErpNKOzM1noE3CWlaeeSfIF/84ZgsZNLQdk5ZiykR+75NHu4EgKc6qMjitrZah\nEV1WmTx18K8tGEndo7ypmprJjjf1kGc3V3WGAPluelyuCMb5bW6yMxzZk2j+az1W\npj22H2CKir9AnKIxA4KYoyPygr3HtmJFiVqR+BH1JhPgfyJxK3HouNU4\n-----END CERTIFICATE-----"
  ],
  "tlsLeaf": "-----BEGIN CERTIFICATE-----\nMIIDHDCCAgSgAwIBAgIBMTANBgkqhkiG9w0BAQsFADAnMSUwIwYDVQQDExxvdGhl\nci1jbG91ZC1pbnRlcm1lZGlhdGUtcnNhMB4XDTI2MDEwMTAwMDAwMFoXDTI3MDEw\nMTAwMDAwMFowHjEcMBoGA1UEAxMTcm91dGVyLmV4YW1wbGUudGVzdDCCASIwDQYJ\nKoZIhvcNAQEBBQADggEPADCCAQoCggEBAMMDTFyhahEYGIvHb63Be/7GZ+p76bsj\nRmv7/FYX9mg7MGJ+kxPwjHl4NuH9Vk/HEoCPW7HQVhUBUb88gR7NDoqnyCmXV3Ek\nyFovf+aE3Ia5GxzI8eFcLFHqwYqM5vTQuN14WYexjSQl8H9AgdISl2DyzstXQhzZ\n04pRxZtzn4krpyrqAa0znU4WV57kjdEbEtFLf72147yvGC2X9Lo5+zxTj+ccBeOJ\nqHzL2jU/YWt4EXtuiLqj8ocgCG4FmITApmYrLEEedv7FvFORYZuZ+7KHc7XcWoFZ\nkbwZtUcERFm+LFf8FEsN0Tu/ehj3Rkkh4pul18xj9UDmYoSTxt3dWzUCAwEAAaNc\nMFowCQYDVR0TBAIwADAOBgNVHQ8BAf8EBAMCBaAwHQYDVR0lBBYwFAYIKwYBBQUH\nAwEGCCsGAQUFBwMCMB4GA1UdEQQXMBWCE3JvdXRlci5leGFtcGxlLnRlc3QwDQYJ\nKoZIhvcNAQELBQADggEBAJgkkesPl7OFZfsVWcUoGDw6nDiVT0oOzf4++h2xrzoV\nhpTX7xwVsbV1YFwvnDkW56erzu/mlGEdRmut71KLSA9GrG3iYcn38fVnDvPZtV8K\nykR/WeI3maAGubdPojaneSBnrIbyatbxSmBDHwhm069AB+YPuoJTEzY9TqJJSa1H\nHZ3KRwPWB83M+J1Z8zeidiZBO7x/ef1Xc+4XLFDTtkO4ictcu7BRuBjOINYCV4jZ\nQUrdVq8rTgb/Ygs/88VrDSIvu1QVra/FOuDmRgncXVgrsB4Bq3HdabahM36ek6sp\nYdOFD4Faw7aKvv0J+PtZymSrQ4Yr/nNnXbS8LTJqHvY=\n-----END CERTIFICATE-----"
}
